Name,Description,Template
PocketSuite," is ycbacked mobile app service businesses  fitness trainers home cleaners dog walkers photographers etc  helping them message schedule and collect payment their clients

 ",6
Podium, is an interaction platform local businesses ,1
Poppy, makes it easy parents to find high quality childcare with just text ,1
Knowmia,pandora meets yelp   educational videos  we match each student with the best teachers their individual learning style to help them grasp key concepts school ,5.1
MicroEval,changing the way companies review employee performance with quantitative short easytodo evaluations ,6
Rappi," delivers in minutes groceries cash clothing burgers and more everything in bogot√° and mexico delivered under   dollar  hyper local hyper fast
 ",6
Real Artists,we make fast and native issue tracker software projects ,2
Redspread,version control software environments ,6
Reduced Energy Microsystems,building the lowestpower silicon embedded deep learning and computer vision ,2
Relativity Space, is creating revolutionary autonomous platform to build the future of humanity in space we are  printing entire rockets we disrupt    years of aerospace tradition relativity's longterm goal is to print the first rocket made on mars ,2
Restocks,buy sneakers and streetwear here ,1
Natero,datadriven customer success platform b saas ,4
Salt Security, detects and prevents zeroday api attacks with the power of ai deploys in minutes no configuration required forever ,2
SendBird, is the world's no  chat api mobile apps and websites ,6
Silver,low cost consumer device toxin detection  ,1
Scoutzie, is curated community the best mobile designers if your startup is looking great designer let us know and we will work with you to find the best possible match ,5.1
Spinal Singularity,devices to improve the quality of life people with spinal cord injury and disease ,2
Scaphold io,the universal api ,3.2
Stealth Worker,information security  cyber security  compliance and privacy if you need  policies procedures penetration tests  pen tests  auditors part time staff vendor management or privacy  incl gdpr and data protection officer  dpo   help ping me ,2
Stilt,we use technology to extend credit to immigrants first product is loan visa holders   opt etc  you can get loans the first day you arrive in the us ,1
Stitch,care coordination platform healthcare ,1
Streamup, is live streaming community music we make it fun and easy to watch chat with and support your favorite musicians ,6
Survata,we let brands measure consumer preferences   behavior ,4
SunFarmer,reliable and affordable solar energy in developing countries ,6
Testmunk,automating mobile app testing ,5.1
Vastrm,mass customized active apparel we are building full turn key technology and manufacturing platform that will allow other retailers and brands to be able to offer customized apparel to their customers   get your corporate apparel with us    ,5.1
Toymail,connected toys that enable twoway voice messaging between children and their friends and family ,6
Carsabi,we are building an index of every car on the internet to help find your next automotive purchase ,5.1
Exec, is house cleaning service that users can book their iphone or the web in realtime  ,5.1
Truebill, is autopilot your personal finances  we let you manage your subscriptions lower your bills and stay on top of your financial life ,6
MyVR,the open platform the vacation rental industry ,6
Unnyhog,"video game development company
we are creating unique and revolutionary games
we want to push game industry forward ",6
UpLabs, is place where designers   developers come to share discover and interact with the resources they need to build sites and apps  ,6
VINEBOX,wine by the glass at home ,6
Wakie," is voice conversation app 
set topic and call someone who is interested right away ",4
WorldCover,funding platform global insurance starting with crop insurance in the developing world  ,6
X Zell,we make cancer curable disease  removes healthy cells standard blood samples and visualizes leftover circulating tumor cells on laboratory slides seamlessly integrating into routine laboratory workflows ,4
Yardbook,marketplace   software revolutionizing yard care ,6
Zenysis,building powerful data analysis software developing countries ,6
Priceonomics,we help companies turn their data into great stories ,5.1
Appcanary, tracks the dependencies you use in your apps and servers and notifies you whenever you're vulnerable to security vulnerabilities ,6
Assembly,the most cost effective production monitoring inventory tracking and quality control system manufacturing we install sensors in your contract chinese factory to ensure test compliance stop warranty fraud and reduce product liability ,1
Sinovia Technologies,flexible printed oled displays ,3.2
Bistrobot,we make robots that make sandwiches ,6
Bitmovin,video infrastructure the web ,6
Bizzy, is omnichannel marketing ecommerce businesses ,4
Supr Daily,daily milk delivery service in india ,3.2
BlueCrew, is web based staffing agency ,6
Bodyport,preventing heart disease ,6
Shoptiques,lets you shop the world's best local boutiques online ,5.1
Zillabyte,palantir sales people ,5.2
CareLedger, helps companies save money on healthcare expenses by aligning employee interest with the company's ,6
Chaldal, is an online platform grocery and delivery based in dhaka bangladesh ,6
Circle Medical,modern primary care ,2
Wifi Dabba, wireless isp in india ,3.1
Cloudstitch,power your website with google spreadsheets,6
Cofactor Genomics,using rna early diagnosis of disease ,2
Confident Cannabis,online b platform the legal cannabis industry powered by laboratory testing data ,2
AgileMD,productivity software hospitals; predictive analytics and prescriptive guidance embedded within the electronic medical record ,5.1
Cymmetria,shifting the asymmetry of cyber security ,4
Drip Capital,digital trade finance startup using technology to rebuild core parts of the international trade finance infrastructure and make the underwriting and financing of international b transactions seamless small businesses   ,2
Eden,the platform office management  provides top office cleaning it support handymen and supply stocking companies ,6
Fetch,marketplace selfservice truck rental ,1
Flirtey, is the world's first commercial drone delivery service and was founded with the vision of revolutionising four industries  humanitarian courier delivery fast food and online retail ,6
Font Awesome, makes it easy to add vector icons and social logos to your website and pro gives       more icons and svg framework  ,2
Fountain,the hiring automation platform built speed and scale ,1
Foxpass,making enterprise security practices available all companies ,6
Gemnote,premium customized corporate gifts ,6
Gigster, does software development   design on demand submit project   get quote in minutes any app or website we assemble usbased team and manage your entire project top talent mit stanford caltech google facebook ,1
GiveCampus, is the digital fundraising and volunteer management platform nonprofit educational institutions trusted by millions of donors and      schools mission is to advance the quality affordability and accessibility of education ,6
Aisle50,grocery deals ,5.1
Clerky,we build software to make legal paperwork easy startups and their attorneys ,5.1
Gravitational, helps saas companies make more money by giving them turn key  onpremise  offering their enterprise customers ,1
Greenshoe,an app that give people instant lines of credit based on information on their phone ,6
Her,social network women who like women ,1
Heroic Labs,"social infrastructure games and apps

we've built nakama server an opensource distributed server social and realtime games and apps ",2
Hickory, turns your employees into experts ,1
Human Interest, is modern provider startups and small businesses set up and run your entirely online with no paperwork ,2
InnerSpace,a wisdom community startup founders ,6
Fobo,sell to people nearby ,5.1
Interviewed,job simulations and assessments  see candidates in action doing the job they applied whether that's sales customer support financial analysis sem engineering or over     other roles ,4
Ironclad,contract management platform legal teams   ,1
Pingm,phone system sales teams ,5.1
Vidyard,youtube business ,5.2
DrChrono,mission  building the medical practice of the future products  ehr medical billing healthcare api ,5.1
L , makes awardwinning personacare products that improve the ives of women wordwide 's products incude      organic cotton tampons pads   condoms every product sod one is given subscribe onine or find us at target cvs   whoe foods ,1
MemSQL,ansi sqlcompliant distributed inmemory database realtime analytics ,5.1
Sendoid,high speed peer to peer data transport technology consumers    and enterprises  expresso  ,5.1
Maderight,global manufacturing simplified ,6
Markhor, is direct to consumer brand that makes and delivers handcrafted shoes in days at half the price of luxury brands ,1
MicroHealth,"realworld evidence to inform treatment decisions
 ",6
Upverter,the future of hardware design marketplace hardware engineering labour component symbols footprints  models access to manufacturing and enterprise grade ecad designing electronics all rolled into one ,5.1
Venuetastic,venue marketplace ,5.1
New Story Charity,we pioneer solutions to address global homelessness ,2
Ohm,never jump start your car again ,1
Oolu, is the solarcity west africa we lease solar systems with bright lights and cell charging to some of the   households who now spend  more on candles and kerosene ,4
Open Invest,socially responsible investing made easy ,2
Paribus,get money back when prices drop effortlessly,6
PartnerStack, lets companies grow through partnerships ,6
PickTrace,agricultural labor and harvest management solution that delivers workflow and realtime data analytics leading to significant efficiency gains in production costs and harvesting time ,6
XIX ai,next generation image intelligence platform defence intelligence and enterprise sectors ,3.2
PlateJoy,the healthy eating membership that makes weight loss effortless we create customized meal plan you each week with optional sameday delivery of ingredients local grocer without packaging waste ,6
Pro Player, is an elearning platform gamers that want to improve their skills and train esports competitions  ,2
Reach Labs,longrange wireless power enabling the next generation of devices ,2
RedCarpetUp,we lend to people in india that banks cannot see ,6
Roomblocker,hotel booking groups and events ,6
ROSS Intelligence,aipowered legal research platform that can read and answer complex questions about case law  ,2
Scentbird, is netflix perfume   luxury fragrance subscription service that sends you   day supply of designer fragrance of your choice       month ,6
Scope AR, is the leading provider of user guided augmented reality  ar  training solutions  we transform existing classroom manuals or documents into simple and intuitive visual instruction based on proven concept of úsee it do it prove it,2
Second Measure,we help institutional investors leverage consumer spending data ,2
Serica,financial payment and loan services the medical cannabis and healthcare industry using bitcoin blockchain technology  ,4
Airo Health, ai to passively track and manage your mental health  ,3.2
ShapeScale," is personal  scanner and fitness tracker that digitizes your body in photorealistic  visualize on your phone where exactly you gain muscle or lose mass now on preorder on com  üëç

 fitness  health  hardware  iot ",6
Shotput,     develops ai and robotics to completely automate ecommerce supply chains  ,6
Shred Video, builds automated video   photo systems that allow adventure tour operators to create and sell cinematic shareable videos to their customers ,2
SimpleMoney,portfolio tracking indian investments ,6
SnapEDA,the internet's first parts library circuit board design build circuit boards faster with millions of free symbols   footprints ,6
AdGrok,easy sem software,5.1
Sphere Secure Workspace, makes it easy employees to securely use their personal devices at work ,2
StyleBee,marketplace beauty services delivered at the convenience of clients' location and cheaper salons' services ,6
teaBOT, is robot that makes customized cup of grabandgo tea rather waiting in line an offtheshelf product 's customers get madetoorder cup at the touch of button  ,6
Tenant Turner,we help property managers eliminate vacancy with landlord and software backgrounds we built solution the paying side of the marketa fullservice software solution the leasing workflow that makes customers money and saves time ,2
Tesorio, is treasury enablement platform that helps every company operate with the foresight of fortune     finance team ,6
TetraScience,internetofthings labs ,6
The Ticket Fairy, is fullstack enterprise marketing solution events the platform helps to mitigate the capital risk taken to produce events increase analyze their audience realize postevent audience monetization and improve ad campaign roi ,2
Elemeno Health,the first personal assistant frontline healthcare teams we get nurses docs and staff on the same page through justintime microlearning we put best practices in their hands and drive quality and consistency at the point of care ,3.2
Traversal Networks,enterprise threat detection  tuning triage and analysis by experts ,2
AeroFS,secure enterprise collaboration ,5.1
Verge Genomics,we find drugs to treat brain diseases     more cheaply and quickly ,2
Vernox,production planning software construction teams  like asana or jira but designed construction  streamlines planning communication and progress tracking of work plans on complex commercial construction projects  ,6
VOIQ,"conversational ai voicebots sales marketing   service calls
 ",4
Willing,the best way to make your legal will ,1
Fanvibe, is social platform watching sports and communicating with others who are watching the same game ,6
Xfers," makes it possible people to make and receive payments via bank transfers via api 

we built proprietary system to allow us to integrate with any banks in week

drop us note if you are interested in indonesia and singapore ",4
Zeplin," is connected space product teams where they can share designs generate specs assets and code snippets
 ",6
zPREDICTA,"

  formerly ixchel scientific  is creating cellbased biological models that predict how drugs will behave in the human body eliminating the guesswork drug development ",4
20n,using ai to predict biochemistry manufacturing and therapeutics ,4
Hipmunk, takes the agony out of searching flights accommodations cars and more ,6
ExVivo Labs, is developing noninvasive skin patch allergy testing making the process safe simple and certain  ,3.2
Atomwise,artificial intelligence drug discovery ,6
GTRACK Technologies,nanoparticle tracers reservoir characterization during hydraulic fracturing ,3.2
OMG Digital,content discovery platform africa ,3.2
Bankjoy,whitelabel credit union software ,6
Bluesmart, makes smart luggage powered by an app to empower people to travel ,6
Bonfire,reimagining sourcing   is the leading nextgeneration competitive bidding and rfx platform empowering modern procurement teams to make faster more strategic decisions ,1
Booktrope, provides software platform that makes it easy creative teams to turn manuscripts into polished books and market them    at scale ,6
Bright,solarcity developing world ,1
BuildScience,the operating system commercial buildings with little to no additional hardware we make buildings smarter by connecting to hvac lighting metering security and more  ,6
Chariot,the world's first private mass transit service providing commuting experience that's faster more reliable and more comfortable public transit while more affordable ridesharing and driving  commutesolved ,1
Cheddar,the best mobile checking account ,4
Cinder,the world's first countertop precision grill  using two ceramic heating plates to cook your meal to precise target temperature  allows you to create amazing meals every day ,1
Cleanly,laundry   dry cleaning delivered ,1
ClearMind Biomedical,medical devices that save lives and improve recovery patients with brain hemorrhage ,1
Color Dating,actually pivoted to dating app boom  ,2
Cribspot,techenabled real estate company  yc    ,6
Leftronic,business dashboards ,5.1
Rapportive,add profiles to email ,5.1
Democracy Earth,incorruptible digital governance small communities corporations large cities   whole nations ,2
DemocracyOS,online space deliberation policy making and democratic participation we bring institutions and citizens together ,6
DroneBase,at  we provide fast affordable and reliable data the air so customers can make betterinformed realtime decisions about their most critical assets ,6
Tapzilla,woot ios apps ,5.1
EquipmentShare, is the best way to rent track and own construction equipment offering the newest fleet      ondemand service and builtin telematics ,6
Final,a credit card that drastically reduces payment fraud and gives consumers total control over their merchant relationships ,1
Flip, ebay the snapchat generation  fastest guaranteed resale on specialty items  ,1
WorkFlowy, is better way to manage information it provides simple mechanism  zoomable searchable shareable bulleted lists  that has startling versatility and power  ,5.1
Glassjar,clean app check writing ,6
GroupAhead,improve communications with your group's own mobile app ,6
GrubMarket, is today's fastestgrowing online farmers' market supplying fresh healthy local food directly local farms and food producers to local people community and local companies with affordable prices and convenient delivery ,6
HigherMe, helps retail and hourly employers find screen and hire better employees faster ,6
Industrial Microbes,we upgrade methane to chemicals using synthetic biology ,2
Infoharmoni, is data visualization company that visualizes realtime social web and aggregates content ,5.1
Movity,real estate data visualization,4
Kickback,gambling in video games ,1
Kickpay,"a marketplace buying and selling invoices

businesses improve their cash flow and don't have to wait    days to get paid while investors get access to whole new asset class which is extremely liquid low risk and has double digit returns ",6
Labdoor, is building the trusted online drugstore ,6
Leadable,real estate leads ,1
Level,"software eats custom framing
 ",1
Notifo, is mobile application and platform that allows web sites and services to create mobile notifications ,4
Lully, is developing an underthemattress technology that precisely controls sleep stages  we use this to avoid problems in sleep such bedwetting snoring and night terrors by getting users into safer stages of sleep prior to the event ,4
Lumi,packaging online brands ,4
Magic,upgrade your life with      personal assistant ,1
Nowmov, solving the video discovery problem ,5.1
Mashgin,selfcheckout using computer vision ,6
Meadow,point of sale and compliance saas cannabis dispensaries ,1
MetricWire,mobile surveys researchers ,6
Zenedy, was started means to showcase information about obscure topics around the web ,4
Moltin,ecommerce building blocks through simple apis websites   apps apis include inventory cart checkout payments and more ,6
Instantq, allows restaurants to send justintime promotions to customers to increase foot traffic on slow nights ,5.1
NexTravel, is centralized travel booking platform that helps companies save time and money ,6
NimbleRx,full service pharmacy  ,4
Lingt, provided webbased platform learning languages leveraging gaming mechanics and spaced repetition,5.1
Notable Labs,personalized drug discovery blood cancer ,2
Listia,mobile marketplace trading used goods ,5.1
Open Listings,a better way to buy home ,2
Outbound,create automated messages  email ios android push sms and web notifications  that we send in realtime users take actions inside your product measure the effect of each message on user behavior ,1
Pachyderm, is úgit data science we offer complete version control data and give your data science team the same firstclass development tools software developers  ,1
Pakible,"we make it insanely easy to design price and manufacture custom product packaging 

 is an unbeatable experience and price compared to brokers or direct manufacturers ",4
Paperspace, is gpu accelerated cloud platform individuals startups and the enterprise ,6
Pigeonly, is platform that makes it easy people to search find and communicate with an incarcerated loved one   ,6
Platzi, streaming classes on design marketing and code learn industry leaders ,4
Lockitron, makes electronic locks you can control locally your phone or remotely through the internet ,5.1
Popular Pays, is the largest most active and most reliable marketplace where social media creators and brands meet to create content worth sharing ,2
Pretty Instant,"hand selected photographers all occasions nationwide  noselfies
we also build proprietary photomarketing technology used by household brands   innovative startups across the country ",2
Priime, is company dedicated to advancements in technology around visual creative content like photography we work heavily in native desktop mobile and web applications well in the blockchain space with the prm platform ,4
RethinkDB,the open source database the realtime web ,5.1
Rare Door,empowering brickandmortar retailers to sell more and engage shoppers ,2
Raven Tech,"our vision is to build the next generation of ios or android to fundamentally change how we interact with mobile devices

we start flow    you use voice to access hundreds of apps' data and services the cloud in real time ",2
Razorpay,a modern online payment gateway india ,6
ReadMe, provides every company the ability to quickly and easily create beautiful documentation and build loyal and productive developer communities ,4
Remix,helping today's cities design their transportation future ,1
RoboHR, builds hr software companies ,4
Quero Education, online marketplace college programs in brazil it helps students search compare and enroll in programs in over      partner colleges saving money on tuition ,3.2
Rescue Forensics,actionable human trafficking intelligence ,2
Sails Co ,fullservice web mobile   cloud studio providing professional support the sails framework and the opensource tools we build and maintain ,2
Shasqi,implantable hydrogel increases drug effectiveness ,4
Shift Labs,makers of simple affordable medical devices low resource healthcare settings awardwinning dripassist infusion rate monitor provides safe continuous monitoring gravity iv infusions to ensure proper medication dosage in any environment ,2
Shift Messenger,realtime communication solution retail and restaurant employees ,2
SigOpt, is an optimizationasaservice platform that seamlessly tunes ai and machine learning models with stateoftheart bayesian optimization techniques behind simple api ,6
SIRUM," is  úmatchcom ù unused medicine we connect institutional surplus medicine with safetynet clinics
 ",6
Airbnb,book accommodations around the world ,5.1
Spark Gift, makes it easy to send stocks and index funds gifts to friends and family   ,2
Spire,realtime mindfulness and chronic disease sensor platform ,1
Spoil, is gifting the snapchat generation ,1
Robby Technologies,we are building fleet of autonomous mobile robots that travel on sidewalks and deliver things to your doorstep at low cost and high efficiency ,3.2
Tab,booking and payment platform travellers abroad†cheaper and safer travellers   tourist businesses ,1
TARA,ai project manager leading software development ,1
TeamNote,"mobile productivity
 slack mobile workforces 
 ",6
Tech in Asia," is media events and jobs platform asia's tech communities

 ",2
The Human Utility, seeks to eliminate water service disconnections lowincome and elderly people using crowds and data ,2
ThinAir,intelligent data security teams ,6
Echodio, was the easiest way to sync and stream your personal music collection across multiple devices ,5.1
Underground Cellar,wine deals without bastardizing brands ,2
UserGems,identify and engage influencers among your users ,6
Valor Water Analytics," delivers saas platform to utilities to detect and address water loss 
 ",2
Vanhawks,we are making the smart carbon fibre commuting bike and platform smart bikes valour first product has turnbyturn direction blind spot detection system antitheft and best route suggestions through data to take you point to  ,6
Vest,"bringing wider access to financial derivatives 

 ",1
VetPronto,on demand veterinary house calls  ,6
WayUp,marketplace college students and recent graduates to find and apply jobs and internships ,6
Wink Health,the digital sleep clinic ,2
WorkLife, is saas application that helps teams have more effective meetings ,6
Foodoro, is an online marketplace enabling people to buy specialty food directly artisanal producers ,5.1
Zenflow,medical device that provides more effective less invasive treatment bph  enlarged prostate  which affects almost all men at some point in life ,6
Alchemy,thin transparent films automobile windshields to prevent stone chips block solar infrared heat and prevent frost  ,1
Aptible,security management and compliance developers ,4
Backpack,marketplace to get stuff overseas ,4
Bannerman,providing security guards every business ,1
Starsky Robotics,driverless trucks real ,3.2
Beep,cellular networks iot ,4
Bikanta,nanodiamonds cancer detection ,4
