Name,Description,Template
Paragon One,online college career service  parents pay       and platform automatically connects students with professionals successful companies who coach them on picking the right career and preparing interviews       of students get offers   ,2
Pearl,the future of office coffee  keurig convenience meets cafe quality  ,1
GO1,a marketplace of onboarding compliance and professional development training your staff  ,5.1
Penny, makes keeping track of your finances easy having conversation ,1
Pit AI,former goldman sachs and jp morgan quant phd in machine learning   oxford paid by google building ai powered hedge fund committed to charging    management fees return      sharpe ratio     ,2
Leada,online enterprise training in data science and analytics specifically courses in python sql alteryx that focus on industry application ,5.1
Pulse,we're crowdsourced gartner so it executives can learn directly each other via simple instead of paytoplay analyst reports we're building the future   marketplace where enterprise buyers discover and buy technology ,1
RankScience,seo split testing   automation ,6
Lugg,move anything anytime anywhere ,5.1
Request Network, is decentralized network payment requests sort of paypal    ,2
REZI,rent better ,4
Riley,mailchimp sms  ,1
Rippling, makes it unbelievably easy to manage your company's hr and it    in one system ,1
Sandbox, is universal adapter banks  it empowers financial institutions to quickly and safely connect new fintech software to existing systems ,1
AlgoSurg Inc,we make software surgeons to plan bone surgeries in  ,3.2
Mimir,a platform stem courses featuring automated grading plagiarism detection and analytics ,4
Scribe, is an ai based sales development representative that you can hire in    minutes  automates an sdr's job finding leads all the way up till scheduling calls over email ,1
Nebia, is breakthrough shower system based on premium experience beautiful design and     water savings ,4
SourceDNA,bringing transparency to the app stores and helping developers build better apps ,6
Simple Habit, is the netflix of meditation the company has the world's largest curated library of   minute meditations designed different situations and moods,2
Avro Life Science,skin patches generic drug delivery  ,3.2
Smart Alto,messaging robot that helps real estate agents respond to leads  ,2
Triplebyte,intelligent technical hiring ,6
Dealyze,we are building the customer and employee engagement platform franchise organizations  ,5.1
Soomgo, is thumbtack korea asia we are marketplace that helps local service providers such movers piano teachers and wedding planners find new customers ,6
Source, is b marketplace purchasing and selling excess inventory wholesale and liquidation goods ,1
Speak,an ai english tutor that is the best way to become conversationally fluent in english ,1
Biobot Analytics,we analyze city sewage to estimate opioid consumption ,3.2
Sycamore,marketplace companies to add delivery driver in   minutes ,1
Symple,last mile logistics delivery   service teams we bring realtime collaboration to distributed job workflows across scheduling routing live tracking work orders invoices and payments ,4
GiveMeTap,"we produce   sell stainless steel water bottles that enables people to get free water refills partner shops which they can locate via  app 
for each bottle sold we're able to give person in africa access to clean water ",2
Tetra,ai notetaker phone calls ,1
Evry Health,better health insurance companies with         employees that costs up to     less ,3.2
InsiteVR,virtual reality software architecture and new construction  automates the process of going  to vr and offers comprehensive vr presentation tools to help companies use vr to communicate new spaces and ideas to their clients   ,6
Token Transit,a mobile app to pay public transportation we sell mobile ticketing platform transit agencies ,2
Tolemi, is palantir city governments ,6
Trade,we're building africa's commodity exchange  ,1
Tress, is social community black women's hairstyles we are building social community black women to discover hairstyle inspiration find stylists buy products and discuss their hair needs with an engaged community  ,1
Upcall, provides outbound call professionals ondemand through its communication platform   api helping customers fuel their sales pipeline and engage with existing users in minutes ,1
UpKeep,we make beautiful easy to use mobile software maintenance teams ,1
Instavest, allows you to replicate the world's best investments ,5.1
LogDNA," helps engineering teams to debug and monitor production issues by aggregating server and application logs into powerful platform
 ",5.1
Volt Health, is developing medical devices that deliver electrical stimulation to the muscles of the body to treat disease starting with urinary incontinence ,2
Iambiq Technologies,organizations read and process large amounts of textbased data usually handled by humans ,3.2
Wavy,experience music and art in augmented reality ,1
WaystoCap,we are alibaba of africa we are building marketplace african businesses to buy and sell products giving smes access to commerce ,6
Jido Maps,a lightweight api persistent augmented reality ,3.2
Wright Electric,boeing electric planes ,2
Juni Learning,the best online education program kids ,3.2
Zestful,the easiest way companies to give individualized perks to their employees give perks like spotify netflix blue apron corepower yoga stubhub and hundreds more  all without painful reimbursement process ,1
Abundance Labs, incubates and builds alternative currency marketplace businesses  ,2
Airfordable,buy your flights deposit upfront and pay off the rest in installments before your departure date ,6
LUS Brands,hair care products curly hair  ,3.2
AmberBox,detect gunshots | inform law enforcement | empower first responders ,6
ApolloShield, is system that detects unwanted drones and drives them away ,6
Nextop, optimizes the path between your app and backend client libraries   proxy server improves speed reliability and battery usage with no change to your backend ,5.1
BulldozAIR,project management platform construction   maintenance teams ,6
Burrow, is an innovative new furniture company reinventing the way people furnish their home we're changing how people shop ship live with and move their furniture ,1
CareRev,a marketplace healthcare professionals to find shifts  ,6
CoinBundle,the easiest way new investors to build crypto portfolios ,6
CoinTent,recover revenue lost to ad blockers  ,6
Coub, is youtube video loops you can take any video youtube facebook or upload your own trim it to the best part mix it with other videos or add soundtrack ,4
Nomiku,wave food in front of your  and have dinner everyone with different dietary restrictions and preferences  ,4
DevColor,we give black software engineers the support they need to enter and advance in the tech industry ,6
Pomello,analytics software that helps companies measure organizational culture screen talent  fit  and drive high performance cultures ,1
Memora Health,efficiency software that automates patient followup and improves nursing operations in hospitals ,3.2
Emote, is   app that helps schools catch student behavior problems before they start ,1
EventGeek, in event intelligence we help companies drive higher event roi through competitive intelligence team productivity and sales enablement ,6
Expo, brings together the best of web  development speed fast iteration cycles easy deploys and automatic crossplatform support  and the performance and user experience of native apps let's talk if you're planning to build mobile app ,4
Newfront Insurance,modern insurance brokerage that leverages technology to vastly simplify the buying process businesses and the selling process brokers ,3.2
Fabric,"echoworks is arun vijayvergiya and nikolay valtchanov two former facebook engineers

we make  an ios app that automatically and privately catalogs your realworld experiences and interactions ",1
Farmstead,an aipowered digital grocer that delivers in under    mins ,1
Flutterwave,we help businesses to make and accept payments anywhere in africa ,6
GoGoGrandparent, is an automated concierge seniors and their families that allows them to order rides meals and groceries flip phone or landline  ,6
Patchd Medical,wearable devices which use deep neural networks to predict and prevent sepsis  the    cause of hospital death  ,3.2
Haywheel, is an artisan food marketplace restaurants and specialty food stores ,6
Hellobill, aggregates all your business bills automatically every month ,6
HiOperator,customer support service we augment your existing team plans are payasyougo scaling up or down needed based on incoming volume we are us based charge on per *solved* case basis not per reply and you only need to train us once ,6
Hush, is the top social commerce app in the united states  ,1
Replika, is an ai friend that you grow by talking to it ,5.1
Transcriptic,the robotic cloud laboratory the life sciences ,5.1
Players' Lounge,a marketplace to play video games against other people money ,2
Joy, is tool that helps couples plan their wedding engagement to honeymoon and everything in between ,1
Jumpcut,online courses that feel like movies ,6
Legalist, uses algorithms to fund lawsuits ,1
Lendsnap,"the digital mortgage company  automatically gathers loan qualifying documents and data to take the pain out of lending  is the only account aggregator enhancing portfolio liquidity with original source documents
 ",6
Checkr,mission is to build fairer future by improving the understanding of the past we're modernizing how background checks are done ,5.1
Flaviar,tryathome service fine spirits ,5.1
Lollicam,the easiest and funniest video creation app to create beautiful moments with your friends and family  it will connect all the contents movie animation cartoon game and any you love with your everyday life  ,6
Looklive, is community and marketplace fashion  users browse the style of celebrities and shop their looks  ,6
Luminostics,smartphone adapter diy disease testing ,6
Naytev, optimizes the packaging and distribution of social content saving teams time and driving more social conversions ,5.1
MessageBird," is an api sending text voice   chat messages we offer the most advanced messaging api packed with features and customizable parameters highvolume and demanding message senders 

 ",6
Metapacket, is the first selective web gateway that stops malware by blocking nonhuman communication in corporate networks ,6
PersistIQ, is sales engagement software that's easy to use ,5.1
Miso,instantly book quality home cleanings in south korea ,4
Multiply Labs,at  we use  printers to manufacture polypills  customized pills that contain multiple medications and release them at the right time ,2
Zen99,tax and insurance tools independent contractors ,5.1
Qulture Rocks, helps midsized companies implement    goals feedbacks and performance reviews in heartbeat with consumergrade technology and hands on content that makes the process much easier goal is to build namely latin america ,3.2
Nova Credit,api global consumer finance information ,2
Zoomer,"outsourced high volume food delivery

 ",5.1
Oh My Green,we make employees healthy happy productive and retain better through snacks beverages catering and more ,2
Repl it,"in   seconds boot up an online programming environment your favorite language

 ",3.2
OneChronos,a financial exchange that reduces costs increases trading volume and prevents information leakage via revolutionary approach to matching buyers with sellers ,6
Algolia,with    data centers in    regions  offers developerfriendly and enterprisegrade search api designed to make every search interaction meaningful and rewarding  serves billions of queries weekly more      customers ,5.1
AptDeco, is peer to peer marketplace buying and selling furniture delivery included  ,6
PatientBank,get medical records online  any doctor or hospital ,6
People ai, automates manual data entry increases sales productivity and provides actionable intelligence across all your management tools ,2
Polymail,email productivity platform business ,6
Vena Medical,making tiny camera that goes inside veins and arteries to help physicians navigate around the body ,3.2
Proxy,reinventing identity ,1
Pursuit,revlo helps broadcasters on twitch engage and monetize their fan base we do this by allowing broadcasters to create interaction opportunities their fans at scale ,1
10 By 10, is building unique marketplace in the recruiting agency industry recruiters to match engineers with jobs recruiting agencies have relationships with proven experienced engineers that you can't find in selfservice job boards ,3.2
Raptor Maps, makes software to manage solar farm construction and maintenance ,2
Ready Education,oohlala is building the mobile os higher education we power over     institutions in   countries to improve student engagement and communication on campus  ,2
Axoni,next generation blockchain and distributed ledger technology ,5.1
Cambly,ondemand access to english tutors over video chat ,5.1
Cambridge Cancer Genomics,ccg empowers clinicians to make personalised treatment strategies cancer patients we use blood monitoring to measure the effectiveness of cancer therapies and ml to tailor treatment decisions  ,2
RocketLit, is an adaptive learning and assessment platform we write articles at   different reading levels serve them to every student in classroom at their independent reading level and fluidly adapt the level students receive they improve  ,6
Rose Rocket, is erp software trucking companies ,2
Sage Care,get care at home mom or dad trusted professionals in their neighborhood manage visits through text and email  ,2
Saleswhale, is an automated sales assistant that follows up with your stale and cold leads engaging them in twoway conversation  before handing off hot leads to your sales team ,6
Selfycart,  let's grocery shoppers scan items and checkout on their phone without waiting in checkout line ,6
Seneca Systems,constituent systemofrecord and service request management software local government ,2
SimpleCitizen,from signup to citizenship only  guides applicants through the entire immigration process providing truly comprehensive solution that's fast accurate and affordable ,6
SkyLights,"vr on planes
as inflight entertainment ",1
SmartSite, is hardware device to protect workers health risks on the construction site it is connected sensor unit that detects noise fine airborne particles and uv we make construction safer and save companies money ,6
Squire Technologies,opentable barbershops ,2
Starcity, builds new real estate product between hotel and housing known coliving mission is to make great cities accessible to everyone  ,6
D ID,protecting faces being identified by facial recognition technologies helping governments hls and corporations to comply with regulations and secure their citizens agents employees and customers ,3.2
Suiteness,get exclusive access to the best suites at luxury hotels ,6
Sway Finance, bringing ai to the accounting industry ,2
Techmate,a technology concierge your home we provide ondemand support all your internetconnected devices ,6
The Athletic,subscription sports media ,2
The Flex Company,flex is new product that replaces tampons ,2
Upgraded, helps retailers and carriers sell devices on upgrade plans ,4
Validere, makes handheld device that provides instant testing of liquid products to large industries  brings lab testing to the field by replacing the need trained technicians to conduct analytical testing ,6
Vetcove, is the largest b marketplace the animal health supply chain veterinary hospitals can compare prices and what's in stock across vendors and buy their pharmaceuticals biologics equipment and supplies one website ,6
Guesty,the management platform the short term rental industry ,5.1
Escher Reality,the backend augmented reality ,3.2
Wallarm,application and api security the modern web ,6
PipelineDB,opensource timeseries data analytics extension postgresql ,6
X3 Builders,a techenabled commercial general contractor we can build your office  ,3.2
WorkRamp, builds training software companies like mcafee intercom and paypal  ,6
Xberts,is crossborder marketplace chinese hardware products  ,4
YesGraph," recommends exactly who user should invite to an app api can help boost the performance of sharing referral and invite flows 

if you have social application or referral program we should talk  ",6
Yoshi,gas delivered to your car so you never have to go to the gas station again ,4
Able Health, gets doctors paid more higher quality care ,2
Shoobs,we help you find and book tickets to great entertainment events that match your taste ,5.1
AlphaFlow," makes investing in real estate easy adding stocks to your portfolio      passive with unparalleled diversification
 
 úyou make   investment we build you diversified real estate portfolio it's that simple ù ",6
Anchor Health,modernizing home health care agencies with software hardware and operating systems ,2
Apollo io," the foundation of your entire gotomarket strategy
 ",2
Shopagram,next generation home shopping network ,5.1
Bonsai,allinone freelancing solution the world's best creative freelancers ,1
Boom,mainstream supersonic passenger airplanes ,1
Bus,the easiest way to charter  in north america ,1
Caper,plugandplay cashierless retail powered by computer vision and ai ,1
Unbabel,ai powered translation service ,4
Castle, manages rental homes landlords using automation and ondemand labor ,1
Castle Intelligence, analyzes user behavior to stop hackers ,2
Chatfuel,platform to easily create chatbots to engage with audiences on messengers ,6
Chillabit, is the best way to procrastinate  it's live feed of funny and relatable student stories that capture student life inside jokes to heartfelt stories it is place sharing your thoughts and connecting around shared experiences ,6
Apptimize, lets mobile teams innovate faster to create an amazing user experience tech lets you instantly update your native android and ios apps testing feature flagging and changes without having to go through the app  play stores ,5.1
Asseta,marketplace industrial spare parts and capital equipment ,5.1
Copia,s forprofit technology company that solves food waste   hunger at scale technologydriven service helps businesses reduce disposal costs save huge on taxes give back to the community while solving the world's dumbest problem  hunger ,6
Cover, is an android and ios mobile application that allows its users to insure anything by taking picture of what they need to insure ,1
Daily co,unlimited  click video calling no time limits no downloads free dialin free    person calls and recording ,2
Deako,we make beautiful connected light switches that allow you to control any light in your home any switch or your mobile phone and we are at least     th the cost of any comparable system ,6
Deepgram,speech ai api large scale fast and accurate voice transcription and understanding we help voice platforms and enterprises transcribe their calls and meetings with selfimproving ai that achieves world leading accuracy and scale ,6
Elucify," is free and crowdsourced database of business contact information

want free leads? let us know   ",4
Embark Trucks,we building selfdriving semi trucks ,2
GoComm,mobile communications platform teams working on live events ,5.1
Enflux,motion capture clothing injury prevention ,6
Senic,premium smart home devices ,4
FightCamp,"interactive boxing and hiit workouts with motion sensors on your wrists that track your punches and bodyweight movements



 ",6
flexEngage,dynamic transactional communications physical stores to help retailers engage customers and increase sales; all while creating the ability to track offline customers and their purchases across retailers  ie offline cookie the real world  ,6
FlowCommand,using ultrasonics   ml to analyze fluid behavior at infrastructure scale  targeting oil wells and pipelines first  ,6
Focal Systems,auto checkout stores using computer vision ,2
Function of Beauty,founded with the mission to revolutionize the beauty industry with customized formulations of shampoo and conditioners tailored to individual hair goals and needs  celebrates individuality through technology ,2
Gecko Robotics,we develop robots industrial inspections ,2
Clipboard Health,we connect nurses with jobs they love and information they can trust  ,3.2
GetAccept,track engage   esign all your sales and business documents with  ,6
Gigwell,building the first saasmarketplace that streamlines the booking process between live entertainers and venues  musicians comedians   public speakers  platform makes it easy to send contracts build tour itineraries and collect online payments ,6
URX,mobile ads that users like  ,4
GoLorry,mobile marketplace longdistance trucking in india ,6
Goodybag,an online tool companies to order food restaurants and caterers ,6
Halolife, is an online platform to find and plan burial or cremation service that meets your needs budget and location  ,6
Hingeto,a b marketplace that connects inventory to online stores ,6
HistoWiz,accelerating histopathology cancer research  ,6
Index,mapping the world's professional relationships  ,1
InnoVein,we cure intractable leg wounds with prosthetic valve veins  ,6
Bitnami,the app store server software ,5.1
Interstate Analytics, is marketing analytics platform that makes it easy to automatically track return on ad spend across multiple channels and devices so you can spend less time in excel sql and ad reporting interfaces and more time on optimizing spend ,2
Iron Ox,robotic greenhouses cheaper sustainable farming ,2
Dost Education,getting kids ready school in india ,3.2
Kip Health,therapy the way it should be  high quality inperson therapy sessions paired with digital support ,2
Indee Labs,indee develops hardware gene delivery we are developing uniquely scalable technology short turnaround cart development and manufacturing ,3.2
Landed, helps essential professionals build financial security near the communities they serve flagship product is sharedequity down payment support public school educators so they can access traditional mortgage and buy home ,1
Lattice,modern performance management software goal management weekly checkins and     performance reviews ,1
CrowdMed, harnesses the wisdom of crowds to solve difficult medical cases online ,6
Locent, is an automated messaging platform companies ,6
Loop Genomics, is platform technology longread dna sequencing ,2
Luminist, is developing novel diagnostic platform early detection of liver disease ,1
Lygos, engineers yeast to convert sugar into highvalue industrial chemicals  ,6
Lynks, is an ecommerce company that makes high demand products accessible to people in developing countries ,4
Magic Instruments, makes hightech guitar that is easier and more enjoyable to learn that anyone can play instantly ,2
MagicBus,we transport commuters between cities and suburbs we do this by creating new bus routes every day based on where people want to go ,6
MailTime,  measurable  turns transactional email receipts into actionable consumer insights investors and brands ,6
Interana,hadoop impatient people ,5.1
Mason, is elastic mobile infrastructure  like aws but hardwareoriented services ,1
Meter Feeder, enables local government to accept credit card payment parking without upgrading their infrastructure ,2
MineralSoft,data management platform oil   gas assets ,6
Mio, powers seamless communication between workplace chat apps ,4
Monthli, is the first marketplace homeowner associations  we offer free property management software to gain access to    hoas and their   homeowners  we charge premium services and connect vendors to these hard to reach customers ,6
Kalibrr, matches people to jobs on the basis of interests experience and skills and we operate talent marketplaces in southeast asia  ,4
Mux,"api to video infrastructure and analytics

video  stripe video
data  new relic video ",1
Semantics3,data and ai based enterprise solutions ecommerce marketplaces  catalog generation   enrichment seller onboarding  logistics companies  hts tariff classification attribute enrichment  and brands  market share   trend reports price monitoring  ,5.1
Nova, helps salespeople write highly personalized     emails at scale ,1
NURX, is the fastest way to get oral contraceptives and truvada prep  ,4
Open Motors,  formerly osvehicle  is b company that is developing edit modular selfdriving ev and provides readytouse hardware platform which enables companies to produce complete electric vehicles in half the time and     the cost ,2
Trainzen,educational assessments made easy eliminating paperbased exams in higher ed ,5.1
Outschool,marketplace of live online classes kids ,6
Patchwork Security,security patch notifications servers build it deploy it and we'll help you keep it secure ,2
Pave, analyzes google analytics   marketing data and sends you reports on what's working what's not and how to improve ,1
Paystack,modern payments infrastructure africa ,6
Petcube," is on the mission to improve lives of pets and pet owners using technology 

our first product  camera keeps people connected to their pets allowing to watch talk and play with pets remotely with builtin laser toy  ",6
Amicus,tools nonprofits and political campaigns that win more donors more members and more votes ,4
Plato,we help engineering   product leaders develop soft skills and build better teams ,4
