Name,Description,Template
WATERFX,the world's first      sustainable water provider  aka alternative water utility  we use solar desalination to generate fresh water unusable water anywhere in the world    ,5.1
Algoriz, is an ai based algorithmic trading platform that enables you to build robust algorithms by simply typing your trading ideas in english  ,4
NewCraft,a recruiting service candidates with pending job offers  ,6
Dyneti Technologies,reduce payment fraud ,3.2
NEXGENT, solves the growing shortage of it engineers enterprise companies by providing job ready certified engineers ,6
Nutrigene,personalized liquid supplements based your health data ,6
observe ai,automating quality assurance qa  process in call centers leading to     reduction in qa cost and  increase in the monitoring coverage ,2
Obsidian Labs, focus on building blockchain products and developer tools dapp ecosystem ,2
Arthena,quantitative investment in art assets  ,5.1
Openland,professional messenger to talk with people outside of your organization ,6
OpenSea, is the first and largest marketplace digital collectibles which include gaming items digital art and other virtual goods backed by blockchain on  anyone can buy or sell these items using smart contracts ,6
Orangewood Labs, makes beautiful furniture quickly using robots  ,2
Arylla, is taking on the    trillion counterfeit industry first product is an invisible ink used to print serial numbers on products that can be read with any smartphone ,4
OurMenu, provides an online food ordering service ,6
BloomAPI, helps doctors share clinical data today most healthcare data is still sent by fax and mail  has built technology that can be set up in minutes and share this data in real time ,6
Pagedraw, is platform productionizing designs into code  thanks to  no one will ever have to learn html or css again even the most complex apps ,6
Passerine Aircraft," is building the next generation of drones
we are developing autonomous fixed wing aircraft capable of takingoff and landing like birds   ",2
Evo Do,qa bots games ,3.2
Pathrise,yc your career ,6
Persephone Biome,we are using the gut microbiome to cure cancer  ,2
Playbook,we make it easy to hang out with college students around you ,1
Maitian ai,we make       amazon go stores ,3.2
Manycore io, speeds up computer programs by spreading them automatically onto several cores ,3.2
Precious,ai to curate your baby photos ,1
Promise, helps government agencies better meet the needs of people in the criminal justice system technology supports just   equitable alternatives to incarceration helps people navigate the criminal justice system and reduces recidivism rates ,1
Proof, helps you increase website conversions through personalized social  ,1
Proven, is building personalization to ecommerce with technology we're launching in september      fresh out of ycombinator preseries with killer exec team mission is to revolutionize cpg that has fallen asleep at the wheel  ,1
boxouse,portable affordable beautiful smart homes ,5.1
Pulse,we're crowdsourced gartner so it executives can learn directly each other via simple instead of paytoplay analyst reports we're building the future   marketplace where enterprise buyers discover and buy technology ,1
Fiix, sends expert auto mechanics to your home so you don't have to waste time   money at the repair shop it's essentially an uber auto repair ,4
Quantstamp,security auditing blockchain smart contracts ,6
Quit Genius,a mobile app that delivers personalised therapy to help people quit smoking ,2
Modoo Technology,modoo develops safe and noninvasive tech to help mothertobe to monitor fetal heart rate and movement mothers can benefit safer and enjoyable pregnancy its online consultation modoo is creating an ai system that prevents fetal distress ,3.2
Seawise Capital,trade finance company indian exporters ,3.2
Reverie Labs,building pharma company scratch using machine learning ,2
InnaMed,we're creating connected home blood testing device to improve post acute care ,4
Runa HR,automating payroll latin america software platform includes  payroll employee management time tracking and reporting ,1
SafetyWing,global social safety net membership ,6
Neema, is an app unbanked workers which provides checking account debitcard and instant remittance to    countries all    month ,5.1
Peer5,p delivery network that enables high quality video streaming at massive scale ,5.1
Shogun,ecommerce storefront builder ,1
Shone, makes existing cargo ships autonomous through retrofit ,1
Playment,"mechanical turk enterprises
 ",5.1
Shiok Meats, is cellbased clean shrimp company the first of its kind we employ cellular agriculture to grow crustacean meat by using cells instead of animals  ,3.2
Sketchbox,photoshop ar   vr ,6
Skip,electric scooters reliable lastmile transportation ,1
Slite,the note app teams ,1
Snackpass,skip the line at restaurants collect points and send gifts to friends üéÅ ,6
RelianceHMO, uses mobile phones telemedicine and data science to make health insurance in africa cheaper and easier to access ,5.1
Sqreen, revolutionizes the way engineering teams protect their apps   customers against attacks ,4
Squad, is facetoface messenger sharing your phone screen with friends ,1
Station, is building the browser work it is native desktop application unifying within single interface all of the web applications used by an employee at work  ,1
Substack,the platform subscription publishing ,6
Sudden Coffee,crystallized coffee that's better fresh starbucks ,2
Super," is an agentled commerce app indonesia
 ",1
Supermedium,browser the vr internet surf thousands of vr apps on the web without having to install any of them ,6
Swayable, measures how media content changes minds so  advocacy organizations and brands can dramatically improve roi ,1
Tarjimly, connects refugees and aid workers with realtime translators using facebook messenger we allow bilinguals to volunteer their language skills to help refugees and immigrants struggling to communicate with doctors lawyers and ngos ,6
ScopeAI,automatically extract valuable insights customer service conversations using ai ,6
Taali Foods,food company that offers products made non gmo whole and natural ingredients ,3.2
Tingles, is video platform relaxation it's the best place to find content that helps you relax and fall asleep main focus is video genre called asmr the biggest and fastest growing relaxation technique ,1
Tipe,we make it so developers never have to manage text ,1
Torch Leadership Labs,leadership development  platform with integrated coaching software and feedback to raise high performers to the next level ,2
Tradewind BioScience, is building therapeutics to attack the most ly human cancers current lead is humanized antibody that inhibits ovarian cancer growth and metastasis ,1
Treasury Prime,apis to automate banking ,2
ServX, is india's premier mobile app auto repairs we connect drivers with vetted local garages with high quality service and spare parts ,4
Universe,make an awesome website  your phone ,1
Vathys,deep learning processors   faster the tpu ,4
Trexo Robotics,wearable robots to help people walk starting with children with cerebral palsy ,3.2
Shipamax,on mission to fix the ship booking experience ,5.1
Snappr, lets you instantly book prevetted photographer at fixed price only hours ahead of the shoot time     ,5.1
Volley,voicecontrolled games on alexa and google home  ,1
Wing It,"discover weekend getaways near you via facebook messenger 
 in the bay area ",2
Worklytics, is productivity analytics teams gathered data in tools like suite slack and office     ,6
YouTeam,"a platform building your remote dev team
hire colocated team of vetted worldclass engineers in europe or latin america  and get the work started in days 
scale your team and get an onsite pm at no additional cost
 ",6
Solugen,we make ultrapure hydrogen peroxide plants ,4
VoiceOps," is platform analyzing enterprise voice 
our mission is to provide easy access to customer conversations product analyzes sales and support conversations and generates insights on phrases that maximize success
 ",5.1
Viosera Therapeutics,we solve drug resistance cancer and antibiotics ,3.2
CrowdAI,infrstructure and other feature detection satellite imagery we use deep learning computer vision algorithms to detect infrastructure such roads buildings and other features satellite imagery ,6
Drivezy,india's largest vehicle sharing platform turning people's vehicles into earning members of the family ,5.1
Airthium,we make large scale   mw   thermodynamic energy storage systems ,6
Innov8,we provide coworking offices to startups freelancers and smes in india ,4
Audm, is subscription service providing miniaudiobooks    wordforword narrations    of longform articles the new yorker the atlantic new york magazine politico magazine wired and many more publications ,4
AutoHub,we help dealerships appraise vehicle tradeins more efficiently accurately  is the only appraisal tool that incorporates vehicle diagnostic data and cosmetic condition into streamlined appraisal process ,6
BillionToOne,prenatal genetic testing every expecting mother ,6
Instrumentl, simplifies the grants process researchers and nonprofits  ,5.1
Caelum Health, is replacing drugs with software we use behavioral medicine delivered digitally to treat diseases where drugs don't work we're starting with ibs which affects     of the us and costs an additional       per individual each year  ,2
YourChoice Therapeutics, is revolutionizing the contraceptive market by developing firstinclass nonhormonal unisex contraceptive ,3.2
CarDash,managed marketplace automotive services  ,6
Carrot Fertility,customized fertility benefits modern companies  ,2
Cashfree,nextgen digital payments provider india  ,6
CocuSocial,marketplace local activities ,6
Covetly,collectibles marketplace ,6
CureSkin,ai dermatologist india ,6
CB Therapeutics,we produce pure cannabinoids like cbd and thc using yeast and sugar no plants involved ,3.2
dahmakan, delivers readytoeat meals at below restaurant prices to the fast growing middle class in asia ,6
Livement,mobile app that sells tickets and concessions sports stadiums ,5.1
Dharma Labs,the protocol borrowing and lending on blockchains ,2
disclosures io, helps real estate agents manage share and review property disclosures ,2
Dropleaf,subscription service all you can play indie pc games  ,6
LocoAI,small lowcost lidar ,6
Entocycle,automated factory to produce insect protein farm animals  ,6
Enzyme,"software that helps life science companies with fda approval and compliance think turbotax but companies that need fda approval 
 ",1
Cytera CellWorks,machines that automate the growing of human cells biotech cuttingedge cancer treatments are driving huge demand these kinds of cells at scale ,3.2
Fastpad,hiring software india ,6
Fat Llama, is the first fully insured peertopeer rental marketplace the insurance allows us to focus on high end professional equipment such dj equipment photography gear and more ,2
Feather," is furniture subscription service people who aspire to live light
 ",1
Flock Safety," makes wireless security systems neighborhoods

while only     of nonviolent crime is solved today with wireless license plate reading cameras goal is to take that to     
 ",2
Flowspace,ondemand warehousing business ,6
Forever Labs,we bank your stem cells to help you live healthier longer ,2
FriendSpot, is group messaging app that helps you coordinate with your friends to meet up in the real world ,6
Gameday,play fantasy sports with friends on facebook messenger ,6
Gamelynx,competitive multiplayer mobile games ,6
Gem,email automation recruiters ,1
Goosebump,find the best electronic music events in single message ,6
Greo, is mobile video app conversations about current events  ,4
Guggy, is building the messaging app of the future with real time nlpbased personalized gifs ,4
Mindori, builds whitelabel voice search ecommerce apps ,5.1
Gustav,the marketplace staffing agencies companies leverage the network of 's selected staffing agencies to hire manage and pay the best talent over one single point of contact with single requisition ,4
Headstart, uses machine learning to help companies decide on who to hire we save recruiters up to     of the time typically spent reviewing applicants and ensure that companies only hire people that would be good fit their culture  ,6
Helium Health,electronic medical records africa's largest hospitals  ,2
Fintual Inc ,roboadvisor latin america ,3.2
HelpWear, is healthcare platform that engages in developing products medical technology industry ,6
Honeydue,the simplest way couples to manage money together ,6
HotelFlex,the first fully flexible hotel booking model that lets you checkin and checkout of your room at anytime you want and pay accordingly ,6
NeoWize, created new type of machine learning algorithm and uses it to improve personalization algorithms in ecommerce sites ,5.1
Grabb It, is location based dynamic digital  ooh advertising platform we turn rideshare cars into digital billboards we install small hardware in cars which displays advertisement to out of car audiencebrands local business are advertisers ,3.2
Kestrel Materials," makes temperature responsive fabrics bedding and clothes thin when warm and thick when cool the insulation of the kestrel fabric changes with temperature to offer unrivaled thermal comfort
 ",2
Lambda School,we train people to be software engineers free in exchange share of their future income ,2
Leena AI,"we at  build virtual assistant that answers employee's hr questions eg how do sign up dental insurance what's my    contribution? why is my salary less this month? result an hr professional can save   hours day
 ",3.2
Loop Support,we do customer support service ,2
LotusPay,recurring payments solution businesses in india ,6
Lyrebird,our tech speaks itself ,1
May Mobility, deploys fleets of autonomous vehicles central business districts enterprise campuses and residential communities ,2
Meetingbird,automated meeting scheduling teams ,6
Modern Fertility, is an athome fertility test women who aren't ready kids right now but want to check in on where they stand  ,2
Modular Science,we're improving farming using robots and science ,2
NuCypher,the privacy layer of the decentralized web ,4
OpenAI, is nonprofit artificial intelligence  ai  research company ,2
NextDrop, is the water marketplace urban india  we connect water buyers with suppliers ,6
Nimble,a better applicant tracking system schools ,1
Oncobox,finding the right cancer drug each patient  ,6
OneLocal, is crm local businesses ,6
Opearlo, produces voice apps amazon alexa and google home ,4
Meru Health, is digital clinic mental health we offer an appbased treatment program that is supported by remote licensed therapists smart dataanalytics to individualize treatment and payonlyforoutcomes business model ,3.2
Reebeez, creates powerful microengines uavs with  hr   flight time microengine has specific energy  better batteries at third of the cost  expands the possibilities and applications of uavs  ,4
Piggy,app indians to make investments in mutual funds manage their investment portfolios and save retirement  vanguard india  ,1
Plasticity,apis that help developers create humanlike natural language interfaces ,1
PreDxion Bio,fast blood test to save the lives of er patients ,1
Prelim, is mobilefirst platform that can power inperson and online retail and commercial product originations banks ,1
Prism Labs,community development platform the blockchain economy ,2
PullRequest,code review service  combining automation with network of ondemand reviewers ,6
Py, is democratizing access to career opportunities in tech ,4
RigPlenish,on average each ambulance run is two hours long    minutes is spent on doing paperwork vision is to reduce those    minutes to   minutes ,5.1
Quilt Data, continuous data integration and delivery platform that accelerates the creation testing and deployment of trusted datasets ,2
Rabbet, brings efficiency accuracy and transparency to construction finance we use machine learning to parse documents and connect information reduced administrative burden verifiable compliance and faster decisionmaking real estate ,1
Relationship Hero,instant professional help your romantic relationships via phone or live chat ,2
Retool,build internal tools dramatically faster ,1
Rev Genomics,biotechnology company creating new strains of cannabis ,2
Ribbon Health, provides accurate and comprehensive data on doctors insurance plans and costs of care healthcare enterprises via an api ,2
RideAlong,we save lives by giving police and health workers key info to safely interact with those with mental health issues chemical dependencies and homelessness this saves cities millions of dollars by streamlining resources and coordinating care  ,6
Whyd,we make beautiful great sounding voicecontrolled speaker  ,5.1
Airmada,autonomous ground stations drones ,5.1
SafeButler,onestop insurance quotes ,6
Seed,mobile banking small business ,1
Sixty,houzz websites ,1
Skyways,creating new form of air transportation ,1
Slik, enables the long tail to use email outreach  ,4
Solve,we save travelers hours by meeting them at their arrival gate expediting the immigration customs process and making sure they're safely off in their vehicle we operate in over     airports worldwide and help with departures and connections too ,1
SourceBeacon, is an ondemand procurement concierge sourcing products china we connect your product requests to network of verified vendors and deliver quotes directly to you ,6
ConstructVR,the simplest way to test manage and deploy vr ar apps at scale ,6
Standard Cognition,aipowered checkout retail ,2
DoseDr,helping diabetes patients use the correct amount of insulin preventing the      billion in annual costs diabetes complications and hospitalizations ,6
Emburse, lets businesses issue virtual or physical debit cards to employees  with  companies can set spending controls on each card and simplify bookkeeping via automatic transaction categorization ,4
Surematics,"we help commercial insurance brokers structure complicated deals

brokers use collaboration platform to negotiate terms share documents and agree contracts

we enforce these agreements using blockchain technology ",6
Templarbit,protecting applications malicious activity ,6
Tesseract, builds better thrusters modern satellites ,1
Thematic, analyses customer feedback to tell companies how to increase satisfaction and decrease churn ,1
Totemic,a hardware device senior care to allow them to age in place and their loved ones can know they are safe using wireless signals and sensor fusion system detects activities and falls in home without the user having to wear anything ,1
Tpaga,mobile wallet latin america  ,4
Ubiq,screensharing enterprise conference rooms ,4
UpCodes,we're building software to modernize the construction compliance industry  we check architects'  models code violations you can think of us building the first linter the construction industry ,6
Value Voting,platform to defeat political extremism through strategic primary voting we help advocacy leaders identify new voters vulnerable incumbents and source candidates we use targeted data to connect strategic voters with centrist candidates     ,2
Envyl, enables fast reliable and cost effective peer to peer delivery overseas shoppers  ,5.1
VergeSense,aipowered building management ,6
VIDA & Co ,platform unique products produced ondemand at massscale ,4
LendEDU, is marketplace consumer financial products ,5.1
WheelStreet, is motorbike rental marketplace that connects motorcycle rental vendors in india with riders the user can book any motorcycle in    cites across india through platform user can compare bikes on the basis of location and reviews ,6
Wildfire, keeps students informed of important events happening on campus and makes it easy to spread the word quickly when something significant happens ,1
Mylk Guys,amazon vegans ,3.2
Zendar,we make high definition radar allowing selfdriving cars to see in all weather conditions ,6
Zinc Platform,insurance distribution infrastructure ,2
ACLU,defender of rights and liberties ,4
AlemHealth,ai radiologist in box  we provide vertically integrated ai radiology solution hospitals and radiology centres in emerging market to ensure access to radiology anywhere  ,6
NetBeez,detect network problems before users do ,5.1
Ambient,visual intelligence the real world ,1
Anasen," is an app that makes data analysis easy and accessible to nontechnical business users
 ",6
AON3D,additive manufacturing with advanced materials ,4
Apozy,proxyless secure web gateway to safeguard against dangerous websites phishing attacks and malware ,4
Armory,continuous deployment the enterprise we help software teams ship better software faster while improving the day to day life of an engineer through automation and engagement ,1
OpenTrons,we are building the pc of lifescience labs    liquid handling robot connected to the 'app store' or 'github' of protocols mixbio where scientists can download experiments to run on their otone  ,5.1
Perlara, is the first personalized drug discovery platform partnering with families and biopharma around the globe to cure diseases thought too rare to matter ,5.1
Beek,netflix audio ,1
Bicycle AI," provides customer support service we work on top of existing helpdesks and respond to repetitive and routine support requests
we've built full stack solution that marries human   machine intelligence ",2
Bitrise,hosted continuous integration and delivery mobile apps ,6
Protonet," provides the easiest way small business to run its own private cloud with beautiful  orange  devices and under   minutes of setup time 
we aim to democratize cloud infrastructure ",5.1
Pulpix,content discovery inside video ,5.1
Breaker,a podcast company ,1
Osh's Affordable Pharmaceuticals,making low cost versions of high cost generic drugs ,3.2
Bulletin,wework retail space ,1
Buypower, is the paypal of africa starting nigeria by making the purchase of electricity extremely easy africans we light up homes at the click of button ,6
Cartcam, is an app opinionated dealseeking shoppers  it gives people discounts creating short video reviews ,6
Clear Genetics, is scaling delivery of genomic services ,2
Plato Design,we provide design services to startups  is building the first mlenabled design firm and we're excited to work with yc companies on their brand and product design needs  ,3.2
Collectly, is datadriven patient revenue platform that helps medical groups   health systems solve the problem of patient billing and posttreatment pricing transparency ,6
Cowlar,"fitbit dairy cows farms use 's alerts   recommendations to improve dairy margins by     we charge      month per cow the service 

we are  iot   machine learning experts solving real problem dairy farms   ",6
Credy, is full stack lending company india we are mobile credit line with customisation specific end use ,4
Delee,a medical device company who created companion diagnostic test cancer therapy management  ,6
Rebellyous Foods,"seattle food tech  sft  is food manufacturing technology and production company with mission to make alternative meat production affordable factoryfarmed animalbased meat    
 ",3.2
Faire, is marketplace empowering retailers to discover and try products riskfree while helping makers reach retailers across the country we create simple tech tools retailers so that they can focus on building and running their business ,4
Fibo,scheduling invoicing and financial insights field teams ,6
Revl, is an ai powered video experience platform ,5.1
Firsthand, makes softwareenabled selfserve retail kiosks that carry high margin products they average      kiosk in daily net revenue and cost      kiosk to make payback period is three days ,1
FloydHub,floyd is heroku machine learning and deep learning run and deploy your project to the cloud with zerosetup  ,6
SOUNDBOKS,we're creating the loudest batterydriven speaker on the market ,5.1
Hogaru, is techenabled facility management platform smbs and homes in latin america  ,4
Humi, is an allinone people platform canadian companies payroll hr and benefits  ,4
Scanwell Health,scanwell is the first and only fdacleared urine testing app first test provides ondemand relief urinary tract infections allowing anyone to test their urine in   minutes and receive prescription antibiotics the same day ,3.2
StrongIntro, helps recruiters turn their entire company into source engineering candidates we run sourcing sessions where we show employees all the engineers in their linkedin networks ,6
Tovala, makes home cooking effortless by pairing countertop smart oven with companion meal delivery service ,5.1
TRAC,an end to end timing solution any scale athletic event  ,4
Spero Foods,recreating dairy   eggs plants ,3.2
LitHit,smart target shooting sports ,6
lvl5,hd maps selfdriving cars ,4
Marketfox,marketing automation platform optimized mobile and web  ,6
TrendMD,article recommendations doctors ,5.1
Branch8, helps sellers to list and manage products on ecommerce marketplaces  ,5.1
Millibatt, makes world's smallest and most customizable batteries 's new small battery technology delivers more  higher energy density existing small batteries ,4
Move,supermarket of the future  ,1
Call9, delivers ondemand doctors in emergency situations ,5.1
Convox,opensource tools deploying managing and monitoring cloud infrastructure ,4
Niles,knowledge assistant work ,6
No Lean Season,a bus ticket out of poverty ,2
Origin,keurig healthy smoothies ,1
