Name,Description,Template
Pilot, lets companies build teams pool of vetted engineering and design talent platform handles contracts invoicing payments and more we're trying to make adding talent to your team easy single click ,1
Curtsy, is an app that lets women rent dresses each other ,1
Draftbit, is new way to visually build cross platform native ios and android apps ,6
Percept AI,ai support agent your business that actually works ,2
Pachama,marketplace carbon credits we're bringing online the    carbon market which is growing     yoy after the paris accord ,4
AI Insurance, builds cloudbased claims management software the entire insurance industry     of the industry doesn't have decent software to handle their claims and we provide it at subscription price they can afford ,2
Allure Systems, uses ai to create stunning apparel images ecommerce allure works with leading fashion retailers to improve conversion rates by creating images that resonate with their clients in scalable and cost effective way ,2
Alpaca,api free stock trading ,1
Sunsama, is daily task list the top     of knowledge workers yc founders use it with their teams to manage their daily workload it's part task list part calendar built to complement your existing tooling  asana jira google calendar etc  ,5.1
Askdata,easy data search employees through natural language ,6
Atomic Alchemy,manufacturing nuclear medicine ,2
Aura Vision,visitor analytics physical retail stores using existing security cameras ,2
Avo,prevents human error when implementing analytics ,1
Balto, lets you create and manage your own fantasy sports games like march madness brackets and nfl survivor pools ,4
Basement,the social network your close friends ,1
Bensen,building voice ordering experiences to replace the drivethru ,6
Blueberry Medical,unlimited      access to pediatricians via your smartphone peace of mind and avoiding unnecessary er urgent care and doctor visits ,2
Bottomless,automatic home restocking using weight sensors to figure out the best time to reorder ,1
Boundary Layer Technologies,high speed container ships using hydrofoils  ,2
Calii,pinduoduo latin america ,4
Career Karma,helps job training programs find qualified applicants ,2
CareerTu,online school digital marketing data analytics and ux ui ,6
Catch,redesigning benefits the people personal benefits platform with you at the center way to handle taxes retirement time off health insurance and student loan refinancing    all in one place ,1
Centaur Labs,labeling medical images at scale,2
Chaser,your success playbook simple elegant and delightful workflow tools customer success teams ,1
Cherry, lets employees choose their own workplace perks ,1
Cityfurnish,  rental subscriptions furniture and appliance in india  ,6
Convictional,software manufacturers and brands to sell to any retailer ,1
Taobotics,autonomous robots retails  ,5.1
Termius, is an ssh client that works on desktop and mobile the reason sysadmins and devops love  because it syncs data ,5.1
Berbix,"identity verification and fraud deterrence service
 makes it easy companies to collect and instantly verify photo ids ",4
DevFlight,getting opensource developers paid  ,6
Dockup,on demand staging environments engineering teams ,6
Skill lync,online engineering college india we started by providing mechanical engineering courses and will expand to all other engineering domain by next year current monthly revenue is        and we are profitable we are growing     mom ,3.1
Tailor ED,a   instructional platform that helps teachers find the most effective educational content each student ,3.1
Excepgen," produces difficult proteins at scale quickly 
 ",6
Flockjay,online bootcamp to learn tech sales ,6
Fuzzbuzz,fuzzing service ,6
Geosite, is an enterprise saas platform spatial data through pairing marketplace with integrated data management and collaboration tools  enables customers to leverage spatial data more rapid and accurate planning and operations ,6
Glide,amazing apps spreadsheets ,1
GoLinks, allows companies to significantly increase productivity by creating memorable short links every internal company url these internal link systems have been standard productivity at major companies ,6
Gordian Software, provides the only api travel booking websites to reserve seats and bags ,2
Green Energy Exchange,we deliver affordable renewable energy direct to customers and are creating business to make green energy accessible to everyone   ,2
Habitat Logistics,we power delivery restaurants ,2
Handle, automates the collection process of unpaid construction invoices ,1
Heart Aerospace,"heart makes electric airplanes with an allelectric range of     miles 

we have support and grants the swedish government and lois scandinavian airlines  sas  bra and wideroe    planes worth    ",2
Inito,fertility clinic on your phone ,6
InsideSherpa,online courses large companies to train and hire college students ,6
InterPrime,cash management made easy ,6
INKHUNTER,augmented reality mobile app to try and buy tattoos ,5.1
Landed, helps essential professionals build financial security near the communities they serve flagship product is sharedequity down payment support public school educators so they can access traditional mortgage and buy home ,1
Latchel,     emergency maintenance department property managers and landlords  ,6
Lumos, is an ai powered search tool doctors that gives direct answers to clinical questions using trustworthy sources ,4
Mage,stock market magic  the gathering ,1
Team Mobot, is an ondemand mobile app qa service that uses robots to test on actual devices ,3.1
Thrive Agric, helps farmers in africa access finance best practices and large produce buyers like unilever and nestle ,3.1
Memfault, builds developer tools firmware engineers ,6
Bot MD,ai assistant doctors ,3.1
Mudrex,algorithmic trading with no code ,6
MyScoot,airbnb home hosted social events  we help you meet new people in your city  ,6
Nabis, ships can products brands to retailers ,6
NALA,internetfree payments africa ,4
Nowports, is digital freight forwarder shipping ocean containers to and latin america ,6
Numero,modern financial software that powers democracy ,1
Okteto,the missing application development platform kubernetes ,6
Our World in Data,open access research and data visualization on global development ,2
Inokyo,we bring physical stores to the digital age with cashierless checkout ,5.1
Portal Entryways, upgrades handicap accessible doors so they can be opened completely handsfree by any smartphone ,2
Positive,next generation grab   go food brand ,1
Postscript, is mailchimp sms  text message marketing automation platform ecommerce companies ,1
PreFlight,automated software testing ,1
Prometheus,we remove co  the air and turn it into gasoline ,6
Pronto,ridesharing secondtier cities in latin america ,1
Pulse Active Stations Network,we are connected network of smart health kiosks in india ,2
Releaf,"we use hardware innovation to sell high quality raw materials to food factories in africa 



 ",6
Rune, connects mobile gamers on voice chat and finds them teammates ,1
Sapling Intelligence,ai writing assistant businesses ,2
Saratoga Energy,we sell better carbon nanotubes at onetwentieth the price carbon nanotubes are used in variety of markets and applications such aerospace batteries highstrength roads and concrete well carbon fiber  ,2
California Dreamin,cannabis infused beverages ,3.1
Cognition IP,first techenabled patent law firm ,3.1
Culture Biosciences,we run automated bioreactors service ,2
Slapdash,work across all of your cloud apps at desktop speed,1
Spiral Genetics,large scale genomic data mining software ,2
Kobo360,platform companies now have easy access to large pool of trucks with realtime tracking at affordable and flexible rates drivers conveniently find loads they want are paid instantly and get reverse loads  ,4
Superb AI, uses ai to build annotated training data tech companies and help them develop machinelearning based features and products faster ,2
Supernova, automates development of mobile applications by converting designs  in sketch figma etc  to actual productionready code ios android react native and flutter saving about     on each mobile application made  ,1
Glimpse K12, eliminates ineffective spending in schools ,3.1
Point API, predicts what you want to say and helps you write it in your own voice immediately,2
Tenderd, is heavy equipment rental marketplace middle east and africa ,5.1
Sixfold Bioscience,nanoparticles to deliver cancer cures ,2
Anjuna, creates software perimeter around applications that provides hardwaregrade security the application which completely removes the need to secure or patch the host or the vm  ,4
The Juggernaut,a premium publication  south asian stories ,2
The Podcast App,the fastest growing podcast player ,2
Traverse Technologies,ai driven professional engineering firm ,2
Helix Nanotechnologies,using ai to cure genetic disease ,2
Union Apartment,furnished coliving apartments international students here in the us ,2
Upsolve,turbotax bankruptcy  nonprofit  ,1
VanGo,uber kids ,6
Vectordash,netflix video games ,6
Verto FX,verto is b currency exchange marketplace illiquid currencies with verto businesses can exchange foreign currencies easily and make international payments seamlessly  ,1
Just Appraised, automates property valuation local governments we use machine learning to verify property transactions and provide more accurate valuations ,3.1
VotingWorks,nonprofit building secure and affordable voting machines us elections ,6
WeatherCheck, monitors properties hail damage so that insurance carriers mortgage companies and property owners can take action ,6
Withfriends, runs membership programs small businesses ,6
WorkClout,saas software helping manufacturers increase their factory's operational efficiency ,6
Leon George,buying and owning indoor potted plants made easy ,2
CaptivateIQ, makes it easy to pay your sales teams' commissions ,6
Groww,investing made simple everyone in india ,5.1
Abacus,the modern platform legal and compliance workflows ,1
Ajaib,the first online wealth manager in indonesia ,4
Allotrope Medical,"advancing surgical precision through safe electrical stimulation 's platform technology diagnoses tissue dysfunction and identifies hidden anatomic structures prone to injury during surgery
 ",2
Alpha Vantage,we build accessible and easy to use apis financial market data ,2
And Comfort, is direct to consumer fashion brand plussize women we make plussize basics and sell online at ,2
Anima App,we convert design to code ,2
AnnieCannons,a custom software development consultancy powered by survivors of human trafficking we have transformed into software engineers  we provide softwaredevelopmentasaservice ondemand ,6
Apprentice Health,we deploy sensors and software that increase hospital efficiency ,2
AskMyClass,the first voice assistant teachers ,6
Hunter2, trains engineering teams in application security through interactive online labs developers get handson practice exploiting and patching real web apps written in their tech stack ,5.1
BHRD,"   be heard   helps public companies communicate with investors
 ",4
BlueCargo, helps marine port terminals streamline container management in the yard area  ,6
Paladin Cyber,"cyber security insurance small businesses 
experts in cyber security compliance startup needs well ",2
BrainHi,an automated receptionist doctor and dentist offices that rescues missed calls and chats with patients automatically ,6
BuyCoins,cryptocurrency exchange africa ,6
Canary Technologies,we bring offline hotel bookings online  ,2
Bulk MRO Industrial Supply,"alibaba enterprises in india 

we supply over   products across  brands to the largest corporations of india  ",2
College Pulse,survey research and analytics company focused on college students ,2
Corvus Robotics,autonomous drones to help warehouses scan inventory ,2
Macromoltek,software antibody modeling and analysis ,5.1
CSPA,the computer science proficiency assessment   is comprehensive standardized exam software engineers we find software engineers to take the test and share their assessment results with employers ,4
Curebase,distributed clinical trials ,6
Ledger Investing,marketplace insurance securitization ,2
Data Driven Bioscience,cancer diagnosis   faster   cheaper ,2
Demeanor co,cpg and digital products by influencers ,2
Dinesafe,we crowdsource food poisoning reports and help detect and prevent outbreaks ,6
ExceptionALLY,affordable expertise special needs parenting ,1
FameGame, and interactive tv shows mobile  starting with american idol meets hq trivia ,6
Federacy,security testing and bug bounty platform ,1
The Centre for Effective Altruism,we're your nonprofit portfolio managers we make giving to highimpact charities easy investing with vanguard we're building community of donors who put outcomes first and give with the head well the heart  ,2
Fixers," is travel and experiences marketplace sellers range yoga retreats in mongolia brown bear watching in romania to music festivals in croatia  helps you discover unique trips you can't find anywhere else
 ",1
FREY, is line of exceptional laundry and clothing care products  is meticulously designed to smell better treat your clothing better and generally be better  you others and the planet ,4
Goodly,student loan repayment an employee benefit  ,1
Voodoo Manufacturing,aws manufacturing robotic  printing factory can make    plastic parts in less   weeks at injection molding prices ,2
HeyDoctor, provides online primary care  like refilling birth control hair loss prevention uti treatments labs and more  expert doctors in under   minutes right your phone or browser  ,6
Highrise, is creative virtual world where people can express themselves in unique and authentic ways while making meaningful friendships ,4
HoneyLove, makes undergarments women that apply compression to targeted areas to improve body shape and support posture  ,6
Naborly,ai powered credit scoring underwriting and insurance the real estate industry  ,4
onederful,api dental insurance ,5.1
Quantierra,"sourcing investment real estate
 ",5.1
Rhythmm,read interesting conversations ,5.1
Inscribe,api to identify fraudulent documents ,1
JetLenses,amazon medical products starting with contact lenses ,6
JITX,automatic circuit board design ,4
Khatabook,india's first ai powered sms inbox ,6
Sheertex,the world's strongest sheer knit makers of the world's toughest pantyhose ,5.1
Klarity,ai contract lawyer ,4
Simetrik, is universal reconciliator  software that extracts cleans normalizes filters and reconciles transactions to maintain trusted source of truth transactional data   focus on making it useful through accurate reports and integrations ,4
Kunduz, provides instant answers to students' test prep questions and makes test prep   faster and   cheaper any private tutor ,4
Iris Automation,collision avoidance system industrial drones mission is to enable the    bn industrial drone revolution ,2
LemonBox,customized daily vitamin packs chinese consumers ,6
Medinas Health, helps hospitals redeploy and resell their excess medical supplies   equipment ,2
MentalHappy,we help employers send tangible mental health tools and resources to employees when they experience traumatic life event; injury illness loss anxiety and other emotional traumas ,6
New Incentives,cash transfers that save lives ,2
Modern Treasury,an api moving managing and reconciling money ,2
Momentus,shuttle service small satellites ,6
Mutiny, helps companies personalize their website each visitor in order to convert customers  ,1
Prime Lightworks, inc manufactures electric propulsion systems space satellites we engineer new possibilities in space while drastically reducing cost and waste by replacing propellant systems with radio frequency resonant cavity thrusters ,2
Nestor, is an ai that transforms your employees into successful coaches ,6
OkCredit,"indian smbs use  to track credit extended by them to their customers we are building the biggest and fastest growing credit network in india where     of credit is still issued informally and handled on paper 
 ",6
OpenPhone, gives entrepreneurs and professionals supercharged business phone number in an app ,6
OpenWrench,we help retailers and restaurant chains manage repairs and maintenance across all their locations ,6
Vote org, uses technology to simplify political engagement increase voter turnout and strengthen american democracy ,3.1
Outvote,an app to get democrats to go vote ,1
Oxygen, is banking and lending the gigeconomy we use ai to analyze personal cash flow and credit report data to underwrite freelancers free fdic insured bank accounts debit cards and loans at avg     interest ,1
Paladin Drones,we deploy autonomous drones to     calls software gives first responders live overhead view of scene before they arrive ,2
Papa, connects college students to senior citizens companionship transportation house help tech lessons and more the students are like  grandkids ondemand   ,1
Penta Medical,"smart hardware injury recovery 

 ",2
Phiar,we are developing revolutionary augmented reality navigation driving app with realtime artificial intelligence safety detections this is selfdriving computer vision technology working completely on smartphone ,6
Georgette Packaging, powers the relationship between small businesses and packaging manufacturers ,2
Plexus,highperformance gloves vr and ar ,1
Public Recreation,a new type gym      outdoors offering unlimited fitness classes     month ,2
Sourcify, is the fastest growing sourcing platform that helps hundreds of companies manufacture products around the world ,5.1
RealtyBits,we tokenize us real estate investment funds ,6
Start Closing, is changing the way homeowners and contractors interact with and manage their insurance based restoration projects  ,2
Regology,regulatory compliance with ai  improve compliance reduce cost ,6
RevenueCat, is simple api managing inapp subscriptions  ,6
Blitz Esports, breaks down the complex world of esports and offers new perspectives on noteworthy controversial or impactful topics of the day ,3.1
Send Reality,we enable anyone to capture spaces in  starting with realestate ,2
Shelf Engine, replaces the grocery buyer and guarantees sales the grocery store ,2
Skydrop,a platform that connects latam businesses with shipping providers consolidating volume to offer discounted rates and managing shipping software ,6
Snark AI,cloud ai ,2
Sparkswap,trade cryptocurrency without depositing funds on an exchange ,6
SPATE,trends prediction marketers ,1
Click & Grow, has developed the only farming technology that allows you to grow organic food locally and more cheaply with traditional agriculture  ,2
Stem Sugar,cambridge glycoscience makes sugar substitutes that actually work in food  ,2
Tributi,automating tax filing preparation individuals in latam think turbotax latam ,5.1
Synthetic Minds,secure blockchain smart contracts using program synthesis ,2
Voicery,automated voice acting and emotive speech synthesis with deep neural networks ,5.1
Tall Poppy,protecting your employees against online harassment ,2
AssemblyAI, builds customized speechtotext models customers working with voice data customers use these models to transcribe phone calls media and other types of voice data with unparalleled accuracy and speed  ,2
The Buttermilk Company,instant fresh ethnic food that actually taste homemade we're disrupting the ethnic food market by turning crowdsourced recipes into easytomake and fresh food the growing first secondgen immigrant population  ,2
The Good Food Institute,gfi is focused on working to make plantbased and clean meat dairy and eggs  real meat dairy and eggs but produced without the use of animals  delicious pricecompetitive and convenient possible meet team ,2
Titan, is the new blackrock  we build manage and explain investment funds via mobile app  ,6
Toybox,gather feedback and report bugs on your website ,6
Darmiyan,early detection of alzheimer's disease ,4
Viaopt,uber pool corporate trucking fleets ,6
Elucd,polling through mobile ads to enable governments to make better decisions ,4
Aerones,industrial heavy lift drones hipressure cleaning and firefighting ,6
AesculaTech, is developing smart materials to enable next generation medical devices ,4
Airship, is modern product flagging framework that gives the right people total control over what your customers see and experience ,1
Plate IQ,seamless restaurant operations we are redefining how restaurants operate and buy products at wholesale with intuitive tools and deep data analytics ,2
Guilded, connects esports teams ,1
ArchForm,replacing orthodontic braces with clear aligner and software ,1
Aspire,reinventing banking small businesses in sea ,1
Atrium,modern law firm startups powered by proprietary technology ,1
Thrive Agritech,we design and manufacture energy efficient led lighting fixtures indoor agriculture unique lighting technology grows plants better with less energy ,2
Beanstalk,we grow heirloom produce in automated indoor farms ,1
Bear Flag Robotics, is developing autonomous driving technology farm tractors allows growers to automate and optimize many of their most common tasks this addresses the farm labor shortage and removes workers hazardous conditions ,2
Ben,the easiest way to learn about buy and store cryptocurrency ,1
ReSchedule Med,we help medical residency programs create and manage their schedules by providing end to end scheduling workflows ,3.1
Indivio,customize your digital video ads to be more relevant and improve performance quickly with creative testing and insights   ,4
BUMP,social p marketplace gen ,1
Standard Cyborg,the api the physical world ,2
Callisto,we create tech to combat sexual assault and harassment ,4
Mystro, is an app that makes rideshare drivers up to     more money by automatically accepting the most profitable fares across multiple apps ,5.1
ClearBrain,predictive analytics growth teams ,6
CodeStream,cloudbased service and ide plugins help dev teams discuss review and understand code ,6
Ginkgo Bioworks,the organism company ,3.1
CoinTracker,portfolio   tax manager cryptocurrency ,6
Correlia Biosystems,next generation blood testing to provide     more data to pharma companies ,1
Sliced Investing,crowdfunding hedge funds ,2
Curious Fictions,patreon professional authors ,2
Dear Brightly, makes personalized prescription skincare products accessible to everyone ,2
Delphia, builds artificiallyintelligent surveys that help people make important decisions ,4
Edwin, is an aipowered english learning service delivered by chatbots voice assistants and humans it prepares students standardized tests such toefl and toeic  provides better outcomes in    the time at   the cost of existing methods ,6
EnvKey, password api keys ,6
Theorem LP,the mission is to make credit safe and available we use data science machine learning and software engineering to invest in marketplace lending loans ,3.1
PAYFAZZ,wechat pay indonesia ,5.1
Gainful,personalized protein powder delivered directly to your doorstep ,1
Bop fm,canonical permalinks songs ,3.1
Roofr,marketplace roofing providing instant satellite roofing estimates homeowners ,5.1
Haiku,app builder that unifies design and code ,4
HelloVerify, is an online background screening platform  checkr india    ,6
Hexel,create cryptocurrency your community ,6
Sourceress, is an ai recruiting platform that's reinventing how people and jobs find each other goal is to create world where all   billion people do fulfilling work and work companies that are solving meaningful problems ,5.1
Human Dx,the human diagnosis project ,3.1
Post fm,new email inbox ,3.1
Data Marketplace,hub buying and selling personalized data online ,2
Key Values,helping software developers find teams that share their values  ,2
Lambda Tea,we build selfserve bubble tea dispensers  ,2
Lawyaw, automatically converts your internal businesses and legal documents into smart templates saving you time money and the embarassement of careless errors ,6
LetsDoThis,marketplace endurance events ,6
Lightout,hypertargeted outdoor advertising ,6
Look After My Bills,personal fintech  we optimise your bills every year automatically ,2
People & Pages,service similar to google groups allowing group organizers to manage email lists and publish to the web in one ,2
Sunu," develops devices that augments human capacities to empower the disabled first product is sonar bracelet enabling the blind to feel the obstacles around them and empowering them to move freely
 ",5.1
Medumo,we manage patient instructions hospitals ,4
Meitre,opentable the world's top restaurants; we help them increase profit much     by optimizing table allocation prioritizing high margin bookings at peak hours and eliminating noshows using tickets deposits and credit card guarantees ,6
Anywhere FM, is music player that enables users to upload music collections and play them anywhere the web ,3.1
Mind Emulation Foundation, enables your mind to continue to live on after your body has died ,2
Mirror AI,app that turns selfie photos into thousand emoji that look like you and your friends ,2
Modern Health, is mental health benefits platform employers we are the only solution to cover the full spectrum of mental wellbeing needs through both evidencebased technology and professional support coach or therapist  ,2
mojo,create stunning video stories ,1
Vanido, is your personal ai music teacher starting with singing available ios ,4
